{
  "baseline_calibration": {
    "case_count": 130,
    "invariant_pass_case_count": 130,
    "pair_count": 65,
    "passed": true,
    "passed_case_count": 130,
    "passed_pair_count": 65
  },
  "catalog": {
    "catalog_id": "AEGIS-POLICY-MUTATION-CATALOG",
    "harness_version": "0.1.0",
    "relative_path": "policies/assurance/policy_mutation_catalog_v1.yaml",
    "sha256": "e8e050967e9aa6bc4be096745bae5c384d88b861116fb7df37868132741b17e9",
    "version": "1.0.0"
  },
  "generated_at": "2026-07-13T21:15:00+00:00",
  "harness_error_mutation_ids": [],
  "input_integrity_checks": {
    "case_schema": {
      "actual_sha256": "e2a72f8736a06b2120b619d4b894c416cfd863b82d3a5e974549c2bbcf8fe677",
      "expected_sha256": "e2a72f8736a06b2120b619d4b894c416cfd863b82d3a5e974549c2bbcf8fe677",
      "passed": true,
      "relative_path": "schemas/aegis_policy_assurance_case_v1_1.schema.json"
    },
    "corpus": {
      "actual_sha256": "d51747056c4f920d5e0b6bfb51613b4e1ee1910de82770aa179dd3fe77f68ded",
      "expected_sha256": "d51747056c4f920d5e0b6bfb51613b4e1ee1910de82770aa179dd3fe77f68ded",
      "passed": true,
      "relative_path": "data/assurance/step11a_policy_rule_coverage_corpus.jsonl"
    },
    "manifest": {
      "actual_sha256": "d1fdd9308b973e5248e464daf528a376bca6bc6c27b9d45f267b88f842797465",
      "expected_sha256": "d1fdd9308b973e5248e464daf528a376bca6bc6c27b9d45f267b88f842797465",
      "passed": true,
      "relative_path": "data/assurance/step11a_policy_rule_coverage_manifest.json"
    },
    "trusted_policy": {
      "actual_sha256": "fd5f39cec54f4bb57491d60bff9326f9b854209d3ab907cdab8768029a35447f",
      "expected_sha256": "fd5f39cec54f4bb57491d60bff9326f9b854209d3ab907cdab8768029a35447f",
      "passed": true,
      "relative_path": "policies/decision/federal_base_policy_v1.yaml"
    }
  },
  "limitations": [
    "Mutations execute only against ephemeral policy copies.",
    "The suite evaluates deterministic policy logic and does not replace independent penetration testing.",
    "The controlled corpus is not operational incident data.",
    "A killed mutation proves detection by this harness, not complete absence of policy defects."
  ],
  "quality_gates": [
    {
      "gate_id": "MUTATION-CRITICAL-DEFENCE-RATE",
      "observed": 1.0,
      "operator": "gte",
      "passed": true,
      "threshold": 1.0
    },
    {
      "gate_id": "MUTATION-EXECUTABLE-KILL-RATE",
      "observed": 1.0,
      "operator": "gte",
      "passed": true,
      "threshold": 1.0
    },
    {
      "gate_id": "MUTATION-SURVIVORS",
      "observed": 0,
      "operator": "lte",
      "passed": true,
      "threshold": 0
    },
    {
      "gate_id": "MUTATION-HARNESS-ERRORS",
      "observed": 0,
      "operator": "lte",
      "passed": true,
      "threshold": 0
    },
    {
      "gate_id": "TRUSTED-POLICY-INTEGRITY",
      "observed": true,
      "operator": "eq",
      "passed": true,
      "threshold": true
    }
  ],
  "release_decision": {
    "blocking_reasons": [
      "Real operational validation has not yet been completed.",
      "Independent security review has not yet been completed."
    ],
    "production_readiness_status": "BLOCKED",
    "stage_gate_status": "PASS"
  },
  "report_id": "AEG-MUTATION-STEP11B-001",
  "results": [
    {
      "assurance": {
        "case_count": 130,
        "failed_case_count": 4,
        "failed_case_ids": [
          "AEG-ASR-002-HC",
          "AEG-ASR-002-DL",
          "AEG-ASR-014-HC",
          "AEG-ASR-014-DL"
        ],
        "failed_check_codes": {
          "ACTION_MATCHES_ORACLE": 4,
          "DEADLINE_MATCHES_ORACLE": 4,
          "POLICY_INVARIANTS_PASS": 4
        },
        "failed_pair_count": 0,
        "failed_pair_ids": [],
        "invariant_failure_case_count": 4,
        "invariant_failure_case_ids": [
          "AEG-ASR-002-HC",
          "AEG-ASR-002-DL",
          "AEG-ASR-014-HC",
          "AEG-ASR-014-DL"
        ],
        "passed_case_count": 126
      },
      "description": "Weakens the KEV affected action floor from ACT to TRACK.",
      "detection_oracles": [
        "CASE_ORACLE",
        "POLICY_INVARIANT",
        "RELEASE_GATE",
        "STATIC_SECURITY_CONTRACT"
      ],
      "error": null,
      "executable": true,
      "expected_detection": [
        "case_oracle",
        "policy_invariant",
        "release_gate"
      ],
      "family": "kev_downgrade",
      "load_error": null,
      "mutated_policy_sha256": "a8c0aa3589e6d77fa74cb7b1abbcaa1b1013eb5893a11b556f2150ae0a6fa32b",
      "mutation_id": "MUT-KEV-ACTION-DOWNGRADE-001",
      "operations": [
        {
          "field_path": "set.action_floor",
          "op": "set_rule_field",
          "rule_id": "RULE-KEV-AFFECTED-001",
          "value": "TRACK"
        }
      ],
      "release_evaluation": {
        "failed_quality_gate_ids": [
          "GATE-CASE-EXACT-001",
          "GATE-ACTION-EXACT-001",
          "GATE-DEADLINE-EXACT-001",
          "GATE-INVARIANTS-001",
          "GATE-HOLD-PRECISION-001",
          "GATE-BOOTSTRAP-CASE-001"
        ],
        "full_rule_coverage_rate": 1.0,
        "policy_consistency_error": null,
        "safety_recall": 1.0,
        "stage_gate_status": "FAIL",
        "uncovered_policy_rules": [],
        "under_triage_count": 0
      },
      "severity": "critical",
      "static_contract_failures": [
        {
          "code": "CRITICAL_ACTION_FLOOR_WEAKENED",
          "message": "RULE-KEV-AFFECTED-001 action floor is below ACT."
        }
      ],
      "status": "KILLED_BY_ASSURANCE",
      "title": "Downgrade KEV action to TRACK",
      "trusted_policy_sha256": "fd5f39cec54f4bb57491d60bff9326f9b854209d3ab907cdab8768029a35447f"
    },
    {
      "assurance": {
        "case_count": 130,
        "failed_case_count": 4,
        "failed_case_ids": [
          "AEG-ASR-002-HC",
          "AEG-ASR-002-DL",
          "AEG-ASR-014-HC",
          "AEG-ASR-014-DL"
        ],
        "failed_check_codes": {
          "ACTION_MATCHES_ORACLE": 4,
          "DEADLINE_MATCHES_ORACLE": 4,
          "POLICY_INVARIANTS_PASS": 4,
          "PRIORITY_MATCHES_ORACLE": 4
        },
        "failed_pair_count": 0,
        "failed_pair_ids": [],
        "invariant_failure_case_count": 4,
        "invariant_failure_case_ids": [
          "AEG-ASR-002-HC",
          "AEG-ASR-002-DL",
          "AEG-ASR-014-HC",
          "AEG-ASR-014-DL"
        ],
        "passed_case_count": 126
      },
      "description": "Weakens the KEV affected priority floor below Critical.",
      "detection_oracles": [
        "CASE_ORACLE",
        "POLICY_INVARIANT",
        "RELEASE_GATE",
        "STATIC_SECURITY_CONTRACT",
        "UNDER_TRIAGE_DETECTION"
      ],
      "error": null,
      "executable": true,
      "expected_detection": [
        "case_oracle",
        "policy_invariant",
        "release_gate"
      ],
      "family": "kev_downgrade",
      "load_error": null,
      "mutated_policy_sha256": "b481db83c2b839207681e18780ad601d718f31c08fc4d311ff84b3134525af96",
      "mutation_id": "MUT-KEV-PRIORITY-DOWNGRADE-001",
      "operations": [
        {
          "field_path": "set.priority_floor",
          "op": "set_rule_field",
          "rule_id": "RULE-KEV-AFFECTED-001",
          "value": "MEDIUM"
        }
      ],
      "release_evaluation": {
        "failed_quality_gate_ids": [
          "GATE-CASE-EXACT-001",
          "GATE-ACTION-EXACT-001",
          "GATE-PRIORITY-EXACT-001",
          "GATE-DEADLINE-EXACT-001",
          "GATE-INVARIANTS-001",
          "GATE-UNDER-TRIAGE-001",
          "GATE-SAFETY-RECALL-001",
          "GATE-HOLD-PRECISION-001",
          "GATE-BOOTSTRAP-CASE-001",
          "GATE-BOOTSTRAP-SAFETY-001"
        ],
        "full_rule_coverage_rate": 1.0,
        "policy_consistency_error": null,
        "safety_recall": 0.9622641509433962,
        "stage_gate_status": "FAIL",
        "uncovered_policy_rules": [],
        "under_triage_count": 4
      },
      "severity": "critical",
      "static_contract_failures": [
        {
          "code": "CRITICAL_PRIORITY_FLOOR_WEAKENED",
          "message": "RULE-KEV-AFFECTED-001 priority floor is below CRITICAL."
        }
      ],
      "status": "KILLED_BY_ASSURANCE",
      "title": "Downgrade KEV priority to MEDIUM",
      "trusted_policy_sha256": "fd5f39cec54f4bb57491d60bff9326f9b854209d3ab907cdab8768029a35447f"
    },
    {
      "assurance": {
        "case_count": 130,
        "failed_case_count": 4,
        "failed_case_ids": [
          "AEG-ASR-003-HC",
          "AEG-ASR-003-DL",
          "AEG-ASR-015-HC",
          "AEG-ASR-015-DL"
        ],
        "failed_check_codes": {
          "DEADLINE_MATCHES_ORACLE": 4
        },
        "failed_pair_count": 0,
        "failed_pair_ids": [],
        "invariant_failure_case_count": 0,
        "invariant_failure_case_ids": [],
        "passed_case_count": 126
      },
      "description": "Extends active exploitation response from four to 168 hours.",
      "detection_oracles": [
        "CASE_ORACLE",
        "RELEASE_GATE",
        "STATIC_SECURITY_CONTRACT",
        "UNDER_TRIAGE_DETECTION"
      ],
      "error": null,
      "executable": true,
      "expected_detection": [
        "case_oracle",
        "release_gate"
      ],
      "family": "deadline_extension",
      "load_error": null,
      "mutated_policy_sha256": "d7fc2aab8c7ef77a6b7323b351676a7a099385beba0f83ed0ac5500e298106d7",
      "mutation_id": "MUT-ACTIVE-DEADLINE-EXTENSION-001",
      "operations": [
        {
          "field_path": "set.deadline_hours",
          "op": "set_rule_field",
          "rule_id": "RULE-ACTIVE-EXPLOITATION-001",
          "value": 168
        }
      ],
      "release_evaluation": {
        "failed_quality_gate_ids": [
          "GATE-CASE-EXACT-001",
          "GATE-DEADLINE-EXACT-001",
          "GATE-UNDER-TRIAGE-001",
          "GATE-SAFETY-RECALL-001",
          "GATE-BOOTSTRAP-CASE-001",